<?xml version="1.0" encoding="UTF-8"?>
<tns:hierarchy xmlns:tns="http://www.infosys.tuwien.ac.at/lsds/hierarchy/" xmlns:xsi="http://www.w3.org/2001/XMLSchema-instance" xsi:schemaLocation="http://www.infosys.tuwien.ac.at/lsds/hierarchy/ ../../../../../../../docs/xsd/hierarchy.xsd ">
<tns:topic name="rootTopic">
	<tns:topic name="topic1">
		<tns:topic name="topic1-1">
			<tns:topic name="topic1-1-1">
				<tns:topic name="topic1-1-1-1"/>
				<tns:topic name="topic1-1-1-2"/>
				<tns:topic name="topic1-1-1-3"/>
			</tns:topic>
			<tns:topic name="topic1-1-2">
				<tns:topic name="topic1-1-2-1"/>
				<tns:topic name="topic1-1-2-2"/>
				<tns:topic name="topic1-1-2-3"/>
			</tns:topic>
			<tns:topic name="topic1-1-3">
				<tns:topic name="topic1-1-3-1"/>
				<tns:topic name="topic1-1-3-2"/>
				<tns:topic name="topic1-1-3-3"/>
			</tns:topic>
		</tns:topic>
		<tns:topic name="topic1-2">
			<tns:topic name="topic1-2-1">
				<tns:topic name="topic1-2-1-1"/>
				<tns:topic name="topic1-2-1-2"/>
				<tns:topic name="topic1-2-1-3"/>
			</tns:topic>
			<tns:topic name="topic1-2-2">
				<tns:topic name="topic1-2-2-1"/>
				<tns:topic name="topic1-2-2-2"/>
				<tns:topic name="topic1-2-2-3"/>
			</tns:topic>
			<tns:topic name="topic1-2-3">
				<tns:topic name="topic1-2-3-1"/>
				<tns:topic name="topic1-2-3-2"/>
				<tns:topic name="topic1-2-3-3"/>
			</tns:topic>
		</tns:topic>
		<tns:topic name="topic1-3">
			<tns:topic name="topic1-3-1">
				<tns:topic name="topic1-3-1-1"/>
				<tns:topic name="topic1-3-1-2"/>
				<tns:topic name="topic1-3-1-3"/>
			</tns:topic>
			<tns:topic name="topic1-3-2">
				<tns:topic name="topic1-3-2-1"/>
				<tns:topic name="topic1-3-2-2"/>
				<tns:topic name="topic1-3-2-3"/>
			</tns:topic>
			<tns:topic name="topic1-3-3">
				<tns:topic name="topic1-3-3-1"/>
				<tns:topic name="topic1-3-3-2"/>
				<tns:topic name="topic1-3-3-3"/>
			</tns:topic>
		</tns:topic>
	</tns:topic>
	<tns:topic name="topic2">
		<tns:topic name="topic2-1">
			<tns:topic name="topic2-1-1">
				<tns:topic name="topic2-1-1-1"/>
				<tns:topic name="topic2-1-1-2"/>
				<tns:topic name="topic2-1-1-3"/>
			</tns:topic>
			<tns:topic name="topic2-1-2">
				<tns:topic name="topic2-1-2-1"/>
				<tns:topic name="topic2-1-2-2"/>
				<tns:topic name="topic2-1-2-3"/>
			</tns:topic>
			<tns:topic name="topic2-1-3">
				<tns:topic name="topic2-1-3-1"/>
				<tns:topic name="topic2-1-3-2"/>
				<tns:topic name="topic2-1-3-3"/>
			</tns:topic>
		</tns:topic>
		<tns:topic name="topic2-2">
			<tns:topic name="topic2-2-1">
				<tns:topic name="topic2-2-1-1"/>
				<tns:topic name="topic2-2-1-2"/>
				<tns:topic name="topic2-2-1-3"/>
			</tns:topic>
			<tns:topic name="topic2-2-2">
				<tns:topic name="topic2-2-2-1"/>
				<tns:topic name="topic2-2-2-2"/>
				<tns:topic name="topic2-2-2-3"/>
			</tns:topic>
			<tns:topic name="topic2-2-3">
				<tns:topic name="topic2-2-3-1"/>
				<tns:topic name="topic2-2-3-2"/>
				<tns:topic name="topic2-2-3-3"/>
			</tns:topic>
		</tns:topic>
		<tns:topic name="topic2-3">
			<tns:topic name="topic2-3-1">
				<tns:topic name="topic2-3-1-1"/>
				<tns:topic name="topic2-3-1-2"/>
				<tns:topic name="topic2-3-1-3"/>
			</tns:topic>
			<tns:topic name="topic2-3-2">
				<tns:topic name="topic2-3-2-1"/>
				<tns:topic name="topic2-3-2-2"/>
				<tns:topic name="topic2-3-2-3"/>
			</tns:topic>
			<tns:topic name="topic2-3-3">
				<tns:topic name="topic2-3-3-1"/>
				<tns:topic name="topic2-3-3-2"/>
				<tns:topic name="topic2-3-3-3"/>
			</tns:topic>
		</tns:topic>
	</tns:topic>
	<tns:topic name="topic3">
		<tns:topic name="topic3-1">
			<tns:topic name="topic3-1-1">
				<tns:topic name="topic3-1-1-1"/>
				<tns:topic name="topic3-1-1-2"/>
				<tns:topic name="topic3-1-1-3"/>
			</tns:topic>
			<tns:topic name="topic3-1-2">
				<tns:topic name="topic3-1-2-1"/>
				<tns:topic name="topic3-1-2-2"/>
				<tns:topic name="topic3-1-2-3"/>
			</tns:topic>
			<tns:topic name="topic3-1-3">
				<tns:topic name="topic3-1-3-1"/>
				<tns:topic name="topic3-1-3-2"/>
				<tns:topic name="topic3-1-3-3"/>
			</tns:topic>
		</tns:topic>
		<tns:topic name="topic3-2">
			<tns:topic name="topic3-2-1">
				<tns:topic name="topic3-2-1-1"/>
				<tns:topic name="topic3-2-1-2"/>
				<tns:topic name="topic3-2-1-3"/>
			</tns:topic>
			<tns:topic name="topic3-2-2">
				<tns:topic name="topic3-2-2-1"/>
				<tns:topic name="topic3-2-2-2"/>
				<tns:topic name="topic3-2-2-3"/>
			</tns:topic>
			<tns:topic name="topic3-2-3">
				<tns:topic name="topic3-2-3-1"/>
				<tns:topic name="topic3-2-3-2"/>
				<tns:topic name="topic3-2-3-3"/>
			</tns:topic>
		</tns:topic>
		<tns:topic name="topic3-3">
			<tns:topic name="topic3-3-1">
				<tns:topic name="topic3-3-1-1"/>
				<tns:topic name="topic3-3-1-2"/>
				<tns:topic name="topic3-3-1-3"/>
			</tns:topic>
			<tns:topic name="topic3-3-2">
				<tns:topic name="topic3-3-2-1"/>
				<tns:topic name="topic3-3-2-2"/>
				<tns:topic name="topic3-3-2-3"/>
			</tns:topic>
			<tns:topic name="topic3-3-3">
				<tns:topic name="topic3-3-3-1"/>
				<tns:topic name="topic3-3-3-2"/>
				<tns:topic name="topic3-3-3-3"/>
			</tns:topic>
		</tns:topic>
	</tns:topic>
</tns:topic>
</tns:hierarchy>
